{
  "$schema": "./schemas/webref-branch-ratchet.schema.json",
  "schemaVersion": 1,
  "corpusSha256": "7d4f9fc74b562411c4da0d664f60d8719344ed9ed594c6cc73723c5e07f80260",
  "mismatchCases": 0,
  "summary": {
    "acceptance": 0,
    "observable": 0,
    "cssText": 0,
    "items": 0,
    "atomicity": 0,
    "reparse": 0
  },
  "unresolved": []
}
